[{"id":"coal_to_coke","output":"coke","output_amount":1,"inputs":[{"cargo":"coal","amount":1,"relationship":"required"}]},{"id":"iron_ore_coke_to_steel","output":"steel","output_amount":1,"inputs":[{"cargo":"iron_ore","amount":1,"relationship":"required"},{"cargo":"coke","amount":1,"relationship":"required"}]},{"id":"copper_ore_to_copper","output":"copper","output_amount":1,"inputs":[{"cargo":"copper_ore","amount":1,"relationship":"required"}]},{"id":"sand_to_glass","output":"glass","output_amount":1,"inputs":[{"cargo":"sand","amount":1,"relationship":"required"}]},{"id":"clay_to_ceramics","output":"ceramics","output_amount":1,"inputs":[{"cargo":"clay","amount":1,"relationship":"required"}]},{"id":"bauxite_to_aluminum","output":"aluminum","output_amount":1,"inputs":[{"cargo":"bauxite","amount":1,"relationship":"required"}]},{"id":"titanium_ore_to_titanium","output":"titanium","output_amount":1,"inputs":[{"cargo":"titanium_ore","amount":1,"relationship":"required"}]},{"id":"gold_ore_to_gold","output":"gold","output_amount":1,"inputs":[{"cargo":"gold_ore","amount":1,"relationship":"required"}]},{"id":"silver_ore_to_silver","output":"silver","output_amount":1,"inputs":[{"cargo":"silver_ore","amount":1,"relationship":"required"}]},{"id":"rare_earth_ore_to_materials","output":"rare_earth_materials","output_amount":1,"inputs":[{"cargo":"rare_earth_ore","amount":1,"relationship":"required"}]}]